{
  "schema_version": "1.0",
  "kind": "grader",
  "grader_id": "kit-empty-grader",
  "grader_version": "1",
  "image_digest": "sha256:9999999999999999999999999999999999999999999999999999999999999999",
  "harness_commit": "89abcdef0123456789abcdef0123456789abcdef",
  "hidden_tests_digest": "sha256:aaaaaaaaaaaaaaaaaaaaaaaaaaaaaaaaaaaaaaaaaaaaaaaaaaaaaaaaaaaaaaaa",
  "acceptance_digest": "sha256:bbbbbbbbbbbbbbbbbbbbbbbbbbbbbbbbbbbbbbbbbbbbbbbbbbbbbbbbbbbbbbbb",
  "gold_patch_digest": "sha256:e3b0c44298fc1c149afbf4c8996fb92427ae41e4649b934ca495991b7852b855",
  "harness_config_digest": "sha256:e3b0c44298fc1c149afbf4c8996fb92427ae41e4649b934ca495991b7852b855"
}
